id,score,chapterId,text,imageDesc,imageURL,metadata_json
taj-mahal1::517,0.0,taj-mahal1,"Some insist the Taj was once a Shiva temple — “Tejo Mahalaya,” they call it. They point to its lotus motifs, its symmetry, its perfection. “Only an Indian god could deserve such grace,” they argue. Others reply with dates, documents, and dynasties. The debate rages, louder with every generation. Yet inside the tomb, silence reigns unchanged. Truth and myth bow to the same marble — and it reflects only devotion, not argument.",,,"{""chapterId"": ""taj-mahal1"", ""createdAt"": ""2025-11-17T08:10:37.635254Z"", ""imageDesc"": """", ""imageURL"": """", ""text"": ""Some insist the Taj was once a Shiva temple — “Tejo Mahalaya,” they call it. They point to its lotus motifs, its symmetry, its perfection. “Only an Indian god could deserve such grace,” they argue. Others reply with dates, documents, and dynasties. The debate rages, louder with every generation. Yet inside the tomb, silence reigns unchanged. Truth and myth bow to the same marble — and it reflects only devotion, not argument.""}"
taj-mahal1::402,0.0,taj-mahal1,"Shah Jahan built the Taj with two dreams — one for Mumtaz, and one for himself. For her, it was the Paradise of Rest. For him, the Monument of Meaning. He wanted to show that reason could sculpt heaven, that symmetry could immortalize love. The emperor and his architects fused philosophy with feeling: the soul’s ascent mirrored in marble’s curve. The Taj was never just grief carved in stone — it was faith in form. And so, long after his empire faded, his monument endures — not merely as memory of a queen, but as proof that intellect can build eternity.",,,"{""chapterId"": ""taj-mahal1"", ""createdAt"": ""2025-11-17T08:09:02.590878Z"", ""imageDesc"": """", ""imageURL"": """", ""text"": ""Shah Jahan built the Taj with two dreams — one for Mumtaz, and one for himself. For her, it was the Paradise of Rest. For him, the Monument of Meaning. He wanted to show that reason could sculpt heaven, that symmetry could immortalize love. The emperor and his architects fused philosophy with feeling: the soul’s ascent mirrored in marble’s curve. The Taj was never just grief carved in stone — it was faith in form. And so, long after his empire faded, his monument endures — not merely as memory of a queen, but as proof that intellect can build eternity.""}"
taj-mahal1::405,0.0,taj-mahal1,"The Taj Mahal is not only built of stone — it is built of color and meaning. White marble for the soul, red sandstone for the body. The Mughals believed white belonged to purity and prayer, red to power and protection. The mausoleum glows in white — the realm of spirit; the gateways and mosques stand red — the realm of empire. Together they complete each other like day and dusk. This duality was no accident; it was philosophy in form. For Shah Jahan, to build in white and red was to proclaim both devotion and dominion — he ruled the world, but served the divine.",,,"{""chapterId"": ""taj-mahal1"", ""createdAt"": ""2025-11-17T08:09:06.070143Z"", ""imageDesc"": """", ""imageURL"": """", ""text"": ""The Taj Mahal is not only built of stone — it is built of color and meaning. White marble for the soul, red sandstone for the body. The Mughals believed white belonged to purity and prayer, red to power and protection. The mausoleum glows in white — the realm of spirit; the gateways and mosques stand red — the realm of empire. Together they complete each other like day and dusk. This duality was no accident; it was philosophy in form. For Shah Jahan, to build in white and red was to proclaim both devotion and dominion — he ruled the world, but served the divine.""}"
taj-mahal1::439,0.0,taj-mahal1,"The Taj Mahal carries 25 Qur’anic inscriptions — 14 full suras — flowing across 670 meters of marble. They are not random, but a deliberate map of faith: verses on judgment, forgiveness, paradise. The letters are written in sulus, their lines balanced between heaven and earth. Each curve mirrors the building’s own proportions, every word a measure of symmetry. Together, they transform architecture into revelation. The Taj does not merely contain the Qur’an — it becomes it. Stone turns to scripture; beauty becomes belief. The monument speaks in the language of eternity.",,,"{""chapterId"": ""taj-mahal1"", ""createdAt"": ""2025-11-17T08:09:34.134762Z"", ""imageDesc"": """", ""imageURL"": """", ""text"": ""The Taj Mahal carries 25 Qur’anic inscriptions — 14 full suras — flowing across 670 meters of marble. They are not random, but a deliberate map of faith: verses on judgment, forgiveness, paradise. The letters are written in sulus, their lines balanced between heaven and earth. Each curve mirrors the building’s own proportions, every word a measure of symmetry. Together, they transform architecture into revelation. The Taj does not merely contain the Qur’an — it becomes it. Stone turns to scripture; beauty becomes belief. The monument speaks in the language of eternity.""}"
taj-mahal1::456,0.0,taj-mahal1,"Jean-Baptiste Tavernier, the French jeweler who traded in diamonds, once stood by the Yamuna and whispered a rumor — that Shah Jahan planned a twin tomb of black marble for himself across the river. Historians denied it, yet the myth endured. Every traveler repeated it, as if the Taj itself demanded a shadow, a reflection. Perhaps that is why, at night, its image floats on the water — the dream that never needed to be built.",,,"{""chapterId"": ""taj-mahal1"", ""createdAt"": ""2025-11-17T08:09:46.936648Z"", ""imageDesc"": """", ""imageURL"": """", ""text"": ""Jean-Baptiste Tavernier, the French jeweler who traded in diamonds, once stood by the Yamuna and whispered a rumor — that Shah Jahan planned a twin tomb of black marble for himself across the river. Historians denied it, yet the myth endured. Every traveler repeated it, as if the Taj itself demanded a shadow, a reflection. Perhaps that is why, at night, its image floats on the water — the dream that never needed to be built.""}"
taj-mahal1::480,0.0,taj-mahal1,"By the 1830s, the Taj had become Agra’s common drawing room. British officers strolled with parasols while Indian families picnicked under the cypresses. The fountains sang for everyone. Roses scented the air; mangoes ripened by the marble steps. One evening, a mullah counted beads beside a drummer from the bandstand — neither disturbed the other. In that moment, empire disappeared. The garden was one nation, brief but real.",,,"{""chapterId"": ""taj-mahal1"", ""createdAt"": ""2025-11-17T08:10:06.339819Z"", ""imageDesc"": """", ""imageURL"": """", ""text"": ""By the 1830s, the Taj had become Agra’s common drawing room. British officers strolled with parasols while Indian families picnicked under the cypresses. The fountains sang for everyone. Roses scented the air; mangoes ripened by the marble steps. One evening, a mullah counted beads beside a drummer from the bandstand — neither disturbed the other. In that moment, empire disappeared. The garden was one nation, brief but real.""}"
taj-mahal1::483,0.0,taj-mahal1,"Lord Bentinck once considered selling the Taj’s marble to raise funds. He even stripped Shah Jahan’s hammam in the fort. Rumor spread that the Taj was next — and Agra gasped. Gardeners, priests, and artists protested together. For once, all India agreed: you cannot auction love. The plan was dropped, but the memory lingers — proof that beauty, once threatened, teaches resistance.",,,"{""chapterId"": ""taj-mahal1"", ""createdAt"": ""2025-11-17T08:10:08.282014Z"", ""imageDesc"": """", ""imageURL"": """", ""text"": ""Lord Bentinck once considered selling the Taj’s marble to raise funds. He even stripped Shah Jahan’s hammam in the fort. Rumor spread that the Taj was next — and Agra gasped. Gardeners, priests, and artists protested together. For once, all India agreed: you cannot auction love. The plan was dropped, but the memory lingers — proof that beauty, once threatened, teaches resistance.""}"
taj-mahal1::509,0.0,taj-mahal1,"In 1990, Atlantic City unveiled its own Taj Mahal — not a tomb, but a casino. Neon domes glowed, carpets blazed with gold, and fortunes rose and fell under chandeliers. Tourists gasped; purists winced. Yet beneath all the spectacle, echoes of Shah Jahan’s arches appeared — copies of a love story reimagined as greed. Donald Trump called it “the eighth wonder of the world.” The irony was perfect: a monument built for eternal rest reborn as a palace of restless desire. Even in imitation, the Taj teaches — that grandeur without soul is only noise in marble clothing.",,,"{""chapterId"": ""taj-mahal1"", ""createdAt"": ""2025-11-17T08:10:31.694914Z"", ""imageDesc"": """", ""imageURL"": """", ""text"": ""In 1990, Atlantic City unveiled its own Taj Mahal — not a tomb, but a casino. Neon domes glowed, carpets blazed with gold, and fortunes rose and fell under chandeliers. Tourists gasped; purists winced. Yet beneath all the spectacle, echoes of Shah Jahan’s arches appeared — copies of a love story reimagined as greed. Donald Trump called it “the eighth wonder of the world.” The irony was perfect: a monument built for eternal rest reborn as a palace of restless desire. Even in imitation, the Taj teaches — that grandeur without soul is only noise in marble clothing.""}"
taj-mahal1::518,0.0,taj-mahal1,"Muslim guides tell another tale — that two saints, Jalal-ud-Din and Ahmad Bukhari, brought the stones and blessed the mortar. Without them, they say, the dome would have never held. At twilight, the faithful still visit their dargahs, laying flowers and prayers. No historian records their names, but the breeze between the shrines feels holy. Sometimes, miracles need no proof — only the humility to believe that hands and hearts built together.",,,"{""chapterId"": ""taj-mahal1"", ""createdAt"": ""2025-11-17T08:10:38.439580Z"", ""imageDesc"": """", ""imageURL"": """", ""text"": ""Muslim guides tell another tale — that two saints, Jalal-ud-Din and Ahmad Bukhari, brought the stones and blessed the mortar. Without them, they say, the dome would have never held. At twilight, the faithful still visit their dargahs, laying flowers and prayers. No historian records their names, but the breeze between the shrines feels holy. Sometimes, miracles need no proof — only the humility to believe that hands and hearts built together.""}"
taj-mahal1::535,0.0,taj-mahal1,"As you turn to leave through the Great Gate, the Taj frames itself one last time in the red sandstone arch. It seems smaller now, as if it’s letting you go. The sound of birds, the shuffle of feet, the distant call to prayer — all blend into a quiet rhythm. You look back once more, just as Shah Jahan might have from his prison in Agra Fort. Every visit ends the same way — not with goodbye, but with a silent promise to return.",,,"{""chapterId"": ""taj-mahal1"", ""createdAt"": ""2025-11-17T08:10:52.145386Z"", ""imageDesc"": """", ""imageURL"": """", ""text"": ""As you turn to leave through the Great Gate, the Taj frames itself one last time in the red sandstone arch. It seems smaller now, as if it’s letting you go. The sound of birds, the shuffle of feet, the distant call to prayer — all blend into a quiet rhythm. You look back once more, just as Shah Jahan might have from his prison in Agra Fort. Every visit ends the same way — not with goodbye, but with a silent promise to return.""}"
taj-mahal1::426,0.0,taj-mahal1,"In Persian poetry, the cypress stands tall and proud — the lover; the vine, soft and winding — the beloved. In the Taj, this love is carved into stone. Each slender colonnette twines upward, its body wrapped in vines heavy with lilies, echoing Kalim’s verse: “Wherever a young tree raised its stature, a vine entangled it like a lover.” Here, architecture becomes emotion. The cold marble warms into intimacy. Every pillar holds a silent embrace — strength and surrender intertwined. As light falls on them, the veins of the leaves seem to shimmer with longing. Even marble remembers love.",,,"{""chapterId"": ""taj-mahal1"", ""createdAt"": ""2025-11-17T08:09:22.860515Z"", ""imageDesc"": """", ""imageURL"": """", ""text"": ""In Persian poetry, the cypress stands tall and proud — the lover; the vine, soft and winding — the beloved. In the Taj, this love is carved into stone. Each slender colonnette twines upward, its body wrapped in vines heavy with lilies, echoing Kalim’s verse: “Wherever a young tree raised its stature, a vine entangled it like a lover.” Here, architecture becomes emotion. The cold marble warms into intimacy. Every pillar holds a silent embrace — strength and surrender intertwined. As light falls on them, the veins of the leaves seem to shimmer with longing. Even marble remembers love.""}"
taj-mahal1::436,0.0,taj-mahal1,"Among all who built the Taj, only one man signed his name: Amanat Khan as-Shirazi. His letters inlaid the Qur’an across marble, black stone flowing like ink from heaven. Shah Jahan allowed his name because writing was sacred art — the breath of God rendered by human hand. His suras speak of judgment, mercy, and gardens eternal. Their beauty lies not only in meaning, but in rhythm — elongated stems, measured silence, balanced form. Even today, no visitor fully reads them; they are meant to be felt. Amanat Khan wrote not for eyes, but for the soul’s remembrance.",,,"{""chapterId"": ""taj-mahal1"", ""createdAt"": ""2025-11-17T08:09:31.786043Z"", ""imageDesc"": """", ""imageURL"": """", ""text"": ""Among all who built the Taj, only one man signed his name: Amanat Khan as-Shirazi. His letters inlaid the Qur’an across marble, black stone flowing like ink from heaven. Shah Jahan allowed his name because writing was sacred art — the breath of God rendered by human hand. His suras speak of judgment, mercy, and gardens eternal. Their beauty lies not only in meaning, but in rhythm — elongated stems, measured silence, balanced form. Even today, no visitor fully reads them; they are meant to be felt. Amanat Khan wrote not for eyes, but for the soul’s remembrance.""}"
taj-mahal1::450,0.0,taj-mahal1,"Shah Jahan chose the site of the Taj not in isolation, but beside Taj Ganj — a marketplace where travelers from across the world passed. “So that all foreigners may see it,” he said. From that day, the Taj was not just his offering to Mumtaz, but to humankind itself. Tavernier, the French traveler, called it “magnificence made visible.” Since then, each traveler, painter, and poet has added their own reflection. It began as one man’s grief — and became the world’s mirror of love.",,,"{""chapterId"": ""taj-mahal1"", ""createdAt"": ""2025-11-17T08:09:42.159649Z"", ""imageDesc"": """", ""imageURL"": """", ""text"": ""Shah Jahan chose the site of the Taj not in isolation, but beside Taj Ganj — a marketplace where travelers from across the world passed. “So that all foreigners may see it,” he said. From that day, the Taj was not just his offering to Mumtaz, but to humankind itself. Tavernier, the French traveler, called it “magnificence made visible.” Since then, each traveler, painter, and poet has added their own reflection. It began as one man’s grief — and became the world’s mirror of love.""}"
taj-mahal1::492,0.0,taj-mahal1,"Lala Deen Dayal was born when India was still learning to look back at itself. By the 1880s, he carried his own camera into Agra — not as a servant to the British eye, but as its equal. He photographed the Taj in harsh daylight, revealing its lines without sentiment. His work was clinical, proud, unyielding. British patrons praised him, but few understood what he had done — reclaimed the gaze. Each photograph said quietly, “This belongs to us again.” Through his lens, the Taj stopped being an imperial trophy and returned to being a soul in stone.",,,"{""chapterId"": ""taj-mahal1"", ""createdAt"": ""2025-11-17T08:10:14.537761Z"", ""imageDesc"": """", ""imageURL"": """", ""text"": ""Lala Deen Dayal was born when India was still learning to look back at itself. By the 1880s, he carried his own camera into Agra — not as a servant to the British eye, but as its equal. He photographed the Taj in harsh daylight, revealing its lines without sentiment. His work was clinical, proud, unyielding. British patrons praised him, but few understood what he had done — reclaimed the gaze. Each photograph said quietly, “This belongs to us again.” Through his lens, the Taj stopped being an imperial trophy and returned to being a soul in stone.""}"
taj-mahal1::451,0.0,taj-mahal1,"The Taj Mahal belongs to no one and to everyone. Shah Jahan built it for one soul; the world made it its own. Painters carried it on canvas, photographers in silver light, advertisers on every wall. Its white dome became a language all understood — of love, loss, and perfection. No translation was needed. To see it is to feel something both personal and infinite. It is the only monument that feels like memory itself — everyone’s, everywhere.",,,"{""chapterId"": ""taj-mahal1"", ""createdAt"": ""2025-11-17T08:09:42.888249Z"", ""imageDesc"": """", ""imageURL"": """", ""text"": ""The Taj Mahal belongs to no one and to everyone. Shah Jahan built it for one soul; the world made it its own. Painters carried it on canvas, photographers in silver light, advertisers on every wall. Its white dome became a language all understood — of love, loss, and perfection. No translation was needed. To see it is to feel something both personal and infinite. It is the only monument that feels like memory itself — everyone’s, everywhere.""}"
taj-mahal1::463,0.0,taj-mahal1,"In 1786, British soldiers of Major Palmer camped in the Taj Mahal’s garden towers. The marble domes echoed with foreign footsteps; the fountains turned to resting places for muskets. Yet, even as a military post, the Taj disarmed every man who entered. Letters home spoke not of conquest, but of calm. Even empire, it seemed, could not occupy beauty — it could only borrow it for a while.",,,"{""chapterId"": ""taj-mahal1"", ""createdAt"": ""2025-11-17T08:09:52.967621Z"", ""imageDesc"": """", ""imageURL"": """", ""text"": ""In 1786, British soldiers of Major Palmer camped in the Taj Mahal’s garden towers. The marble domes echoed with foreign footsteps; the fountains turned to resting places for muskets. Yet, even as a military post, the Taj disarmed every man who entered. Letters home spoke not of conquest, but of calm. Even empire, it seemed, could not occupy beauty — it could only borrow it for a while.""}"
taj-mahal1::542,0.0,taj-mahal1,"Beneath the tomb spreads the Charbagh, the garden of paradise. Four stone walks divide its square; four channels of water cross at a central pool, reflecting the dome like a second moon. Each canal once flowed from the Yamuna, feeding fountains that rose and fell to a rhythm of eternity. Lahauri calls it “a mirror of heaven.” Here, the architecture breathes — half marble, half meadow. Sit by the pool at dusk and you’ll see what the Mughals intended: paradise not promised after death, but demonstrated on earth.",,,"{""chapterId"": ""taj-mahal1"", ""createdAt"": ""2025-11-17T08:10:58.027797Z"", ""imageDesc"": """", ""imageURL"": """", ""text"": ""Beneath the tomb spreads the Charbagh, the garden of paradise. Four stone walks divide its square; four channels of water cross at a central pool, reflecting the dome like a second moon. Each canal once flowed from the Yamuna, feeding fountains that rose and fell to a rhythm of eternity. Lahauri calls it “a mirror of heaven.” Here, the architecture breathes — half marble, half meadow. Sit by the pool at dusk and you’ll see what the Mughals intended: paradise not promised after death, but demonstrated on earth.""}"
taj-mahal1::418,0.0,taj-mahal1,"The flowers of the Taj are not merely decoration; they are emblems of empire. The martagon lily — beloved by Ustad Mansur — stands for majesty. The crown imperial evokes sovereignty, and the tulip — the emperor’s favorite — speaks of passion and perfection. These blooms appear not only in marble, but also in the Diwan-i-Khas and the jharokas of Agra Fort, linking palace and tomb in one floral language. They are the Mughals’ own heraldry, a garden of power and purity. In Shah Jahan’s reign, the empire did not conquer land — it conquered the art of eternal spring.",,,"{""chapterId"": ""taj-mahal1"", ""createdAt"": ""2025-11-17T08:09:16.972294Z"", ""imageDesc"": """", ""imageURL"": """", ""text"": ""The flowers of the Taj are not merely decoration; they are emblems of empire. The martagon lily — beloved by Ustad Mansur — stands for majesty. The crown imperial evokes sovereignty, and the tulip — the emperor’s favorite — speaks of passion and perfection. These blooms appear not only in marble, but also in the Diwan-i-Khas and the jharokas of Agra Fort, linking palace and tomb in one floral language. They are the Mughals’ own heraldry, a garden of power and purity. In Shah Jahan’s reign, the empire did not conquer land — it conquered the art of eternal spring.""}"
taj-mahal1::446,0.0,taj-mahal1,"On Fridays and anniversaries of her passing, Shah Jahan laid a pearl chadar upon Mumtaz’s tomb. The pearls caught the light of chandeliers and shimmered like prayers themselves. Around them, carpets spread and candles glowed — the court gathered in solemn remembrance, reciting the Fatiha, feeding the poor, and giving alms. The historian Khafi Khan wrote, “All was done to secure repose for the soul near divine mercy.” The emperor’s love became ritual, and his grief, generosity. Even marble needed light; even memory, renewal.",,,"{""chapterId"": ""taj-mahal1"", ""createdAt"": ""2025-11-17T08:09:39.201146Z"", ""imageDesc"": """", ""imageURL"": """", ""text"": ""On Fridays and anniversaries of her passing, Shah Jahan laid a pearl chadar upon Mumtaz’s tomb. The pearls caught the light of chandeliers and shimmered like prayers themselves. Around them, carpets spread and candles glowed — the court gathered in solemn remembrance, reciting the Fatiha, feeding the poor, and giving alms. The historian Khafi Khan wrote, “All was done to secure repose for the soul near divine mercy.” The emperor’s love became ritual, and his grief, generosity. Even marble needed light; even memory, renewal.""}"
taj-mahal1::470,0.0,taj-mahal1,"In 1803, when Lord Lake took Agra, the British inherited the Taj — the empire’s most delicate prisoner. They measured its arches, mapped its stones, and painted it into notebooks. But the marble would not obey history. It outshone its captors. Officers stood silent under its dome, their boots sinking into Mughal dust. What Shah Jahan built for love, the Company carried to London — in watercolours and wonder. Yet even under foreign eyes, the Taj never changed its meaning: it remained a dream too pure for conquest.",,,"{""chapterId"": ""taj-mahal1"", ""createdAt"": ""2025-11-17T08:09:58.644904Z"", ""imageDesc"": """", ""imageURL"": """", ""text"": ""In 1803, when Lord Lake took Agra, the British inherited the Taj — the empire’s most delicate prisoner. They measured its arches, mapped its stones, and painted it into notebooks. But the marble would not obey history. It outshone its captors. Officers stood silent under its dome, their boots sinking into Mughal dust. What Shah Jahan built for love, the Company carried to London — in watercolours and wonder. Yet even under foreign eyes, the Taj never changed its meaning: it remained a dream too pure for conquest.""}"
taj-mahal1::506,0.0,taj-mahal1,"The hum of Agra’s Taj Ganj never stops — hammers tapping, marble dust rising, chisels whispering into stone. These are the descendants of the men who once built the Taj. Now they carve tabletops, boxes, and coasters for travelers. Each pattern of jasper and jade echoes the petals above Mumtaz’s tomb. “People see souvenirs,” said one craftsman, “but we see prayers.” Their art feeds their families, even if their names fade into dust. The Taj’s beauty lives not only in marble — but in the tired hands that keep shaping it.",,,"{""chapterId"": ""taj-mahal1"", ""createdAt"": ""2025-11-17T08:10:29.684975Z"", ""imageDesc"": """", ""imageURL"": """", ""text"": ""The hum of Agra’s Taj Ganj never stops — hammers tapping, marble dust rising, chisels whispering into stone. These are the descendants of the men who once built the Taj. Now they carve tabletops, boxes, and coasters for travelers. Each pattern of jasper and jade echoes the petals above Mumtaz’s tomb. “People see souvenirs,” said one craftsman, “but we see prayers.” Their art feeds their families, even if their names fade into dust. The Taj’s beauty lives not only in marble — but in the tired hands that keep shaping it.""}"
