id,score,chapterId,text,imageDesc,imageURL,metadata_json
taj-mahal1::338,0.0,taj-mahal1,"Look up, and the kanguras, the crenellations above the screen, bloom like vases of paradise. From each vase rise stems with lotus-like flowers, their petals curling into the open air. Every tiny hillock carved beneath them suggests life emerging from the earth—creation caught mid-breath. The patterns alternate like the rhythm of prayer: one stem, one bud, one blossom, repeated in divine symmetry. Light glides along their edges, awakening hidden veins of color. In these upper rows, the artisans whispered a secret: that even the borders of heaven must carry gardens—so the soul, rising upward, never leaves beauty behind.",,,"{""chapterId"": ""taj-mahal1"", ""createdAt"": ""2025-11-17T07:58:01.460020Z"", ""imageDesc"": """", ""imageURL"": """", ""text"": ""Look up, and the kanguras, the crenellations above the screen, bloom like vases of paradise. From each vase rise stems with lotus-like flowers, their petals curling into the open air. Every tiny hillock carved beneath them suggests life emerging from the earth—creation caught mid-breath. The patterns alternate like the rhythm of prayer: one stem, one bud, one blossom, repeated in divine symmetry. Light glides along their edges, awakening hidden veins of color. In these upper rows, the artisans whispered a secret: that even the borders of heaven must carry gardens—so the soul, rising upward, never leaves beauty behind.""}"
taj-mahal1::352,0.0,taj-mahal1,"The lower tomb of Shah Jahan holds words his soul might have heard upon leaving the world: “He travelled from this world to the banquet hall of eternity.” The marble bears his epitaph—longer, fuller, as if even death could not restrain his longing for beauty. Small poppies and yellow lilies bloom in delicate red cartouches around the sarcophagus. They echo the flowers above, but fainter, humbler. Here, under layers of silence, the emperor who built paradise sleeps as a pilgrim among his own dreams—his throne exchanged for the serenity of Illiyun, the highest realm of heaven.",,,"{""chapterId"": ""taj-mahal1"", ""createdAt"": ""2025-11-17T07:58:16.715921Z"", ""imageDesc"": """", ""imageURL"": """", ""text"": ""The lower tomb of Shah Jahan holds words his soul might have heard upon leaving the world: “He travelled from this world to the banquet hall of eternity.” The marble bears his epitaph—longer, fuller, as if even death could not restrain his longing for beauty. Small poppies and yellow lilies bloom in delicate red cartouches around the sarcophagus. They echo the flowers above, but fainter, humbler. Here, under layers of silence, the emperor who built paradise sleeps as a pilgrim among his own dreams—his throne exchanged for the serenity of Illiyun, the highest realm of heaven.""}"
taj-mahal1::392,0.0,taj-mahal1,"The Taj’s garden was never still. Beneath its pathways, pipes of copper and clay once carried the Yamuna’s breath to every corner. Water flowed in measured symmetry — from aqueduct to fountain, from fountain to root. It was not just irrigation, it was symbolism: the river of paradise described in the Qur’an, divided into four streams of life. To walk there was to step inside divine geometry. Even now, when the fountains rise under modern pumps, the idea endures — that every paradise, no matter how eternal, must be fed by an unseen pulse.",,,"{""chapterId"": ""taj-mahal1"", ""createdAt"": ""2025-11-17T08:08:50.135797Z"", ""imageDesc"": """", ""imageURL"": """", ""text"": ""The Taj’s garden was never still. Beneath its pathways, pipes of copper and clay once carried the Yamuna’s breath to every corner. Water flowed in measured symmetry — from aqueduct to fountain, from fountain to root. It was not just irrigation, it was symbolism: the river of paradise described in the Qur’an, divided into four streams of life. To walk there was to step inside divine geometry. Even now, when the fountains rise under modern pumps, the idea endures — that every paradise, no matter how eternal, must be fed by an unseen pulse.""}"
taj-mahal1::399,0.0,taj-mahal1,"Beyond the Taj’s marble walls stand three quiet structures, built for women history forgot. Their domes do not gleam; their cenotaphs bear no jewels. Yet they complete the story — a circle of loyalty and loss. Here lies a lady-in-waiting, there a noble consort, and beside them, a small mosque still scented with sandalwood and dust. These are not the monuments of empire but of affection — where remembrance escaped inscription. When you stand by their cracked walls and hear a cowbell, a call to prayer, a child’s laughter, know this: even outside the walls of perfection, love built its own eternity.",,,"{""chapterId"": ""taj-mahal1"", ""createdAt"": ""2025-11-17T08:08:55.751510Z"", ""imageDesc"": """", ""imageURL"": """", ""text"": ""Beyond the Taj’s marble walls stand three quiet structures, built for women history forgot. Their domes do not gleam; their cenotaphs bear no jewels. Yet they complete the story — a circle of loyalty and loss. Here lies a lady-in-waiting, there a noble consort, and beside them, a small mosque still scented with sandalwood and dust. These are not the monuments of empire but of affection — where remembrance escaped inscription. When you stand by their cracked walls and hear a cowbell, a call to prayer, a child’s laughter, know this: even outside the walls of perfection, love built its own eternity.""}"
taj-mahal1::313,0.0,taj-mahal1,"At its heart, the Taj Mahal Mausoleum follows the hasht bihisht—“eight paradises”—plan, a design beloved by Mughal builders. Its square form with chamfered corners, called the Musamman Baghdadi, contains nine interlinked chambers. The domed central hall forms the spiritual core, encircled by octagonal and cruciform rooms aligned in perfect symmetry. From every direction—north, south, east, west—the same harmony repeats, mirroring the Qur’anic vision of gardens beneath which rivers flow. Even the walls breathe balance: the outer pishtaqs echo the inner plan, and the dome above mirrors the one within. Here, geometry becomes devotion, and proportion becomes prayer.",,,"{""chapterId"": ""taj-mahal1"", ""createdAt"": ""2025-11-17T07:57:35.453367Z"", ""imageDesc"": """", ""imageURL"": """", ""text"": ""At its heart, the Taj Mahal Mausoleum follows the hasht bihisht—“eight paradises”—plan, a design beloved by Mughal builders. Its square form with chamfered corners, called the Musamman Baghdadi, contains nine interlinked chambers. The domed central hall forms the spiritual core, encircled by octagonal and cruciform rooms aligned in perfect symmetry. From every direction—north, south, east, west—the same harmony repeats, mirroring the Qur’anic vision of gardens beneath which rivers flow. Even the walls breathe balance: the outer pishtaqs echo the inner plan, and the dome above mirrors the one within. Here, geometry becomes devotion, and proportion becomes prayer.""}"
taj-mahal1::398,0.0,taj-mahal1,"The Kali Masjid and its adjoining tomb once formed a miniature paradise — a garden of symmetry, fountains, and marble blossoms. Now, weeds and plaster hide its former grace. Fanny Parks once found its cenotaph stripped of gems, its marble turned dull. Yet traces remain: the curve of an arch, the echo of a fountain, the geometry of devotion. The mosque’s red stone and white domes imitate the Taj’s majesty in humble form — a memory, not a mirror. Every breeze that crosses its terrace carries a whisper from the Yamuna: even ruins can remember paradise.",,,"{""chapterId"": ""taj-mahal1"", ""createdAt"": ""2025-11-17T08:08:55.020930Z"", ""imageDesc"": """", ""imageURL"": """", ""text"": ""The Kali Masjid and its adjoining tomb once formed a miniature paradise — a garden of symmetry, fountains, and marble blossoms. Now, weeds and plaster hide its former grace. Fanny Parks once found its cenotaph stripped of gems, its marble turned dull. Yet traces remain: the curve of an arch, the echo of a fountain, the geometry of devotion. The mosque’s red stone and white domes imitate the Taj’s majesty in humble form — a memory, not a mirror. Every breeze that crosses its terrace carries a whisper from the Yamuna: even ruins can remember paradise.""}"
taj-mahal1::396,0.0,taj-mahal1,"West of the Taj stands a quiet red tomb — likely that of Satti-un-Nisa Khanum, the faithful lady who served Mumtaz Mahal. She journeyed with her mistress from Burhanpur to Agra, guarding her through death itself. Shah Jahan honored her devotion with this tomb, built at imperial expense, its domes of sandstone instead of marble — humble yet noble. Inside rest two cenotaphs, their arches filled with geometric jalis. The air is still, as if awaiting her voice reciting Persian verses. She was no empress, yet the emperor gave her eternity — a resting place beside paradise, not within it.",,,"{""chapterId"": ""taj-mahal1"", ""createdAt"": ""2025-11-17T08:08:53.479473Z"", ""imageDesc"": """", ""imageURL"": """", ""text"": ""West of the Taj stands a quiet red tomb — likely that of Satti-un-Nisa Khanum, the faithful lady who served Mumtaz Mahal. She journeyed with her mistress from Burhanpur to Agra, guarding her through death itself. Shah Jahan honored her devotion with this tomb, built at imperial expense, its domes of sandstone instead of marble — humble yet noble. Inside rest two cenotaphs, their arches filled with geometric jalis. The air is still, as if awaiting her voice reciting Persian verses. She was no empress, yet the emperor gave her eternity — a resting place beside paradise, not within it.""}"
taj-mahal1::318,0.0,taj-mahal1,"At the Taj Mahal, even the smallest lines carry meaning. The slender engaged shafts that stitch the facades together gleam with black and yellow chevron inlay, a motif repeated in the dados below. These zigzags act like stitches in marble cloth—binding the monument’s vast geometry into one living surface. Many have faded to grey over centuries, softened by sun and cleansing, yet their rhythm remains unbroken. Each pattern whispers the same truth: beauty lies not in scale but in precision. Where others carved walls, the Mughals wove stone, turning cold marble into a tapestry of light.",,,"{""chapterId"": ""taj-mahal1"", ""createdAt"": ""2025-11-17T07:57:40.604868Z"", ""imageDesc"": """", ""imageURL"": """", ""text"": ""At the Taj Mahal, even the smallest lines carry meaning. The slender engaged shafts that stitch the facades together gleam with black and yellow chevron inlay, a motif repeated in the dados below. These zigzags act like stitches in marble cloth—binding the monument’s vast geometry into one living surface. Many have faded to grey over centuries, softened by sun and cleansing, yet their rhythm remains unbroken. Each pattern whispers the same truth: beauty lies not in scale but in precision. Where others carved walls, the Mughals wove stone, turning cold marble into a tapestry of light.""}"
taj-mahal1::367,0.0,taj-mahal1,"Once, travelers could climb the minarets and look down upon the Taj’s marble sea. Lady Nugent did so in 1812, leaving her name scratched upon the dome of air. From each balcony, Agra unfolds—the Yamuna shimmering, the gardens breathing below. The railings are low, the wind strong; even the bats stir in the shadows. To stand there is to feel the pulse of eternity through stone. Today the towers are closed, their stairs silent, their chhatris unvisited. Yet the wind still circles them, whispering the names of those who once climbed higher to touch the hush between heaven and earth.",,,"{""chapterId"": ""taj-mahal1"", ""createdAt"": ""2025-11-17T08:08:30.232691Z"", ""imageDesc"": """", ""imageURL"": """", ""text"": ""Once, travelers could climb the minarets and look down upon the Taj’s marble sea. Lady Nugent did so in 1812, leaving her name scratched upon the dome of air. From each balcony, Agra unfolds—the Yamuna shimmering, the gardens breathing below. The railings are low, the wind strong; even the bats stir in the shadows. To stand there is to feel the pulse of eternity through stone. Today the towers are closed, their stairs silent, their chhatris unvisited. Yet the wind still circles them, whispering the names of those who once climbed higher to touch the hush between heaven and earth.""}"
taj-mahal1::373,0.0,taj-mahal1,"Beneath the platform of the Mihman Khana, faint engravings lie hidden — working drawings scratched into the stone by Shah Jahan’s artisans. One shows the silhouette of the great dome’s finial, the crown of the Taj itself. In 1888, a British magistrate, F. Baker, filled it with black marble so it would not fade. Few notice it now, but it is there — a sketch of heaven etched into earth. The builders marked their reverence not only in domes and arches, but beneath their feet. Each line is a quiet testament that even blueprints can hold devotion.",,,"{""chapterId"": ""taj-mahal1"", ""createdAt"": ""2025-11-17T08:08:34.303637Z"", ""imageDesc"": """", ""imageURL"": """", ""text"": ""Beneath the platform of the Mihman Khana, faint engravings lie hidden — working drawings scratched into the stone by Shah Jahan’s artisans. One shows the silhouette of the great dome’s finial, the crown of the Taj itself. In 1888, a British magistrate, F. Baker, filled it with black marble so it would not fade. Few notice it now, but it is there — a sketch of heaven etched into earth. The builders marked their reverence not only in domes and arches, but beneath their feet. Each line is a quiet testament that even blueprints can hold devotion.""}"
taj-mahal1::381,0.0,taj-mahal1,"At each corner of the riverfront terrace stand octagonal towers—three storeys of red sandstone crowned with white domes. Lahauri called them “burj,” towers of grace. Each holds a secret life within: wells, corridors, chambers, and stairs winding toward the river. Their marble cupolas gleam like lilies among trees, echoing the mausoleum’s domes in miniature. From their jharokhas, one could look upon the Yamuna shimmering below. Though closed now, these towers once whispered with water, air, and prayer. They are the Taj’s sentinels—vessels of breath and balance, rising between earth and reflection.",,,"{""chapterId"": ""taj-mahal1"", ""createdAt"": ""2025-11-17T08:08:40.667203Z"", ""imageDesc"": """", ""imageURL"": """", ""text"": ""At each corner of the riverfront terrace stand octagonal towers—three storeys of red sandstone crowned with white domes. Lahauri called them “burj,” towers of grace. Each holds a secret life within: wells, corridors, chambers, and stairs winding toward the river. Their marble cupolas gleam like lilies among trees, echoing the mausoleum’s domes in miniature. From their jharokhas, one could look upon the Yamuna shimmering below. Though closed now, these towers once whispered with water, air, and prayer. They are the Taj’s sentinels—vessels of breath and balance, rising between earth and reflection.""}"
taj-mahal1::304,0.0,taj-mahal1,"The Riverfront Terrace of the Taj Mahal, or kursi, is no ordinary platform—it is the architectural throne of paradise. Mughal chroniclers compared it to the Kursi-yi-‘Arsh Martaba, the Throne of God itself. Rising gently from the garden but soaring toward the Yamuna, it stretches 300 meters in red sandstone and white marble, uniting heaven and earth in stone. Here, Shah Jahan’s vision takes divine form: the terrace becomes both foundation and revelation—a stage for eternity. Every flower carved in relief whispers that even stone can remember paradise.",,,"{""chapterId"": ""taj-mahal1"", ""createdAt"": ""2025-11-17T07:57:26.336674Z"", ""imageDesc"": """", ""imageURL"": """", ""text"": ""The Riverfront Terrace of the Taj Mahal, or kursi, is no ordinary platform—it is the architectural throne of paradise. Mughal chroniclers compared it to the Kursi-yi-‘Arsh Martaba, the Throne of God itself. Rising gently from the garden but soaring toward the Yamuna, it stretches 300 meters in red sandstone and white marble, uniting heaven and earth in stone. Here, Shah Jahan’s vision takes divine form: the terrace becomes both foundation and revelation—a stage for eternity. Every flower carved in relief whispers that even stone can remember paradise.""}"
taj-mahal1::357,0.0,taj-mahal1,"Hidden beyond the marble lattice, the ambulatory chambers of the Taj trace the geometry of devotion. Cruciform rooms open to octagonal ones, arches melt into vaults, and every angle repeats the same divine pattern. The builders called these spaces nashiman—seats of rest. Yet they seem less like rooms than meditations in stone. The plaster vaults, once smooth and glowing, now fade with time. Still, their symmetry endures. Even in simplicity, the order feels sacred—each curve guiding thought inward, toward stillness. The Shish Mahal is not meant for eyes, but for souls—to remind that even around silence, beauty must flow in circles.",,,"{""chapterId"": ""taj-mahal1"", ""createdAt"": ""2025-11-17T07:58:21.042768Z"", ""imageDesc"": """", ""imageURL"": """", ""text"": ""Hidden beyond the marble lattice, the ambulatory chambers of the Taj trace the geometry of devotion. Cruciform rooms open to octagonal ones, arches melt into vaults, and every angle repeats the same divine pattern. The builders called these spaces nashiman—seats of rest. Yet they seem less like rooms than meditations in stone. The plaster vaults, once smooth and glowing, now fade with time. Still, their symmetry endures. Even in simplicity, the order feels sacred—each curve guiding thought inward, toward stillness. The Shish Mahal is not meant for eyes, but for souls—to remind that even around silence, beauty must flow in circles.""}"
taj-mahal1::371,0.0,taj-mahal1,"They say the Mihman Khana, or “Guest Hall,” was built as a jawab — an answer. The mosque prayed on one side; the Mihman Khana replied with silence on the other. Once, on the anniversaries of Mumtaz’s passing, its hall glowed with lamps and poetry as scholars and courtiers gathered to recite her memory. Later, it became a hall of feasts for visiting princes and British officials — a transformation history could not erase. Even now, its red walls seem to whisper the verses once spoken there. The Mihman Khana remains what it always was — a chamber of remembrance.",,,"{""chapterId"": ""taj-mahal1"", ""createdAt"": ""2025-11-17T08:08:32.963283Z"", ""imageDesc"": """", ""imageURL"": """", ""text"": ""They say the Mihman Khana, or “Guest Hall,” was built as a jawab — an answer. The mosque prayed on one side; the Mihman Khana replied with silence on the other. Once, on the anniversaries of Mumtaz’s passing, its hall glowed with lamps and poetry as scholars and courtiers gathered to recite her memory. Later, it became a hall of feasts for visiting princes and British officials — a transformation history could not erase. Even now, its red walls seem to whisper the verses once spoken there. The Mihman Khana remains what it always was — a chamber of remembrance.""}"
taj-mahal1::375,0.0,taj-mahal1,"On either side of the Taj, two red sandstone wings rise like echoes of the marble tomb. The mosque and Mihman Khana mirror each other—each with three domes, each crowned by chhatris, each glowing in the sun’s flame. Their pattern of red and white inlay ripples like woven silk. The mosque holds faith; the guest house holds memory. Together they complete the Taj’s geometry, forming a perfect triad of prayer, remembrance, and reflection. At dawn, the white dome glows between them like the moon between two embers—a trinity of stone whispering heaven’s symmetry.",,,"{""chapterId"": ""taj-mahal1"", ""createdAt"": ""2025-11-17T08:08:35.645908Z"", ""imageDesc"": """", ""imageURL"": """", ""text"": ""On either side of the Taj, two red sandstone wings rise like echoes of the marble tomb. The mosque and Mihman Khana mirror each other—each with three domes, each crowned by chhatris, each glowing in the sun’s flame. Their pattern of red and white inlay ripples like woven silk. The mosque holds faith; the guest house holds memory. Together they complete the Taj’s geometry, forming a perfect triad of prayer, remembrance, and reflection. At dawn, the white dome glows between them like the moon between two embers—a trinity of stone whispering heaven’s symmetry.""}"
taj-mahal1::382,0.0,taj-mahal1,"South of the mosque lies a hidden marvel—the baoli tower, a stepwell carved in red sandstone. Its octagonal shaft pierces through floors, turning circular as it dives deep into the earth. Water once glimmered below, reached by a stairway from the hujra above. Some say it supplied the complex; others believe it was symbolic—a link to Khwaja Khizr, guardian of the waters of life. To descend those steps was to move from sunlight to shadow, from monument to myth. Beneath all the marble perfection of the Taj, the baoli endures—a quiet pulse of eternity below.",,,"{""chapterId"": ""taj-mahal1"", ""createdAt"": ""2025-11-17T08:08:41.484277Z"", ""imageDesc"": """", ""imageURL"": """", ""text"": ""South of the mosque lies a hidden marvel—the baoli tower, a stepwell carved in red sandstone. Its octagonal shaft pierces through floors, turning circular as it dives deep into the earth. Water once glimmered below, reached by a stairway from the hujra above. Some say it supplied the complex; others believe it was symbolic—a link to Khwaja Khizr, guardian of the waters of life. To descend those steps was to move from sunlight to shadow, from monument to myth. Beneath all the marble perfection of the Taj, the baoli endures—a quiet pulse of eternity below.""}"
taj-mahal1::390,0.0,taj-mahal1,"Beneath the marble stillness of the Taj, a hidden miracle once moved — the waterworks of Shah Jahan. From the Yamuna, channels ran through arches and clay pipes, feeding pools, fountains, and gardens. Bullocks turned Persian wheels, lifting water in leather buckets, while engineers measured the fall of every drop. The aqueduct’s whisper carried life to lilies, mango trees, and the marble fountains that once danced before the tomb. The river gave, the earth lifted, and paradise bloomed. Today, its channels lie silent, but their purpose remains — to remind us that even beauty must drink.",,,"{""chapterId"": ""taj-mahal1"", ""createdAt"": ""2025-11-17T08:08:48.184743Z"", ""imageDesc"": """", ""imageURL"": """", ""text"": ""Beneath the marble stillness of the Taj, a hidden miracle once moved — the waterworks of Shah Jahan. From the Yamuna, channels ran through arches and clay pipes, feeding pools, fountains, and gardens. Bullocks turned Persian wheels, lifting water in leather buckets, while engineers measured the fall of every drop. The aqueduct’s whisper carried life to lilies, mango trees, and the marble fountains that once danced before the tomb. The river gave, the earth lifted, and paradise bloomed. Today, its channels lie silent, but their purpose remains — to remind us that even beauty must drink.""}"
taj-mahal1::393,0.0,taj-mahal1,"South of the Taj, near Khan Alam’s garden, stood the keeper’s house of the aqueduct. Its arches guarded the flow, its walls hid the bullocks’ song. Here, engineers checked the channels, and gardeners prayed for pressure enough to lift the fountains. When Curzon restored the Taj, he replaced the clay pipes with iron, but left the same tanks to gather rain and river alike. Today, the Horticultural Office stands upon those arches — still serving water to the same soil. Centuries may change the system, but the purpose remains pure: to keep paradise alive and green.",,,"{""chapterId"": ""taj-mahal1"", ""createdAt"": ""2025-11-17T08:08:51.002991Z"", ""imageDesc"": """", ""imageURL"": """", ""text"": ""South of the Taj, near Khan Alam’s garden, stood the keeper’s house of the aqueduct. Its arches guarded the flow, its walls hid the bullocks’ song. Here, engineers checked the channels, and gardeners prayed for pressure enough to lift the fountains. When Curzon restored the Taj, he replaced the clay pipes with iron, but left the same tanks to gather rain and river alike. Today, the Horticultural Office stands upon those arches — still serving water to the same soil. Centuries may change the system, but the purpose remains pure: to keep paradise alive and green.""}"
taj-mahal1::302,0.0,taj-mahal1,"The Riverfront Terrace of the Taj Mahal is the grand stage where heaven meets the Yamuna. At its center rises the white marble mausoleum, flanked by the mosque and the Mihman Khana—two buildings identical in form, mirroring each other in devotion and balance. This triad is Shah Jahan’s final act of symmetry: faith on one side, hospitality on the other, eternity in the middle. The terrace itself is the world made orderly—red sandstone anchoring marble, water meeting sky—every line converging toward the silent queen who made it sacred.",,,"{""chapterId"": ""taj-mahal1"", ""createdAt"": ""2025-11-17T07:57:24.598397Z"", ""imageDesc"": """", ""imageURL"": """", ""text"": ""The Riverfront Terrace of the Taj Mahal is the grand stage where heaven meets the Yamuna. At its center rises the white marble mausoleum, flanked by the mosque and the Mihman Khana—two buildings identical in form, mirroring each other in devotion and balance. This triad is Shah Jahan’s final act of symmetry: faith on one side, hospitality on the other, eternity in the middle. The terrace itself is the world made orderly—red sandstone anchoring marble, water meeting sky—every line converging toward the silent queen who made it sacred.""}"
