id,score,chapterId,text,imageDesc,imageURL,metadata_json
taj-mahal1::45,0.0,taj-mahal1,"Shah Jahan was born in Lahore in fifteen-ninety-two, to a Mughal father and a Rajput mother. Akbar himself named the child Khurram — “the Joyous.” Raised by Ruqaiya Begam, Akbar’s childless wife, he grew up surrounded by scholars, poets, and Sufi mystics. Yet, his heart leaned toward the sword. By adolescence he rode like a warrior and wrote like a poet. He spoke Persian with the grace of a courtier and Hindavi with the warmth of a commoner. In him, two worlds met — the discipline of Timur and the spirit of India.",,,"{""chapterId"": ""taj-mahal1"", ""createdAt"": ""2025-11-17T07:32:09.391815Z"", ""imageDesc"": """", ""imageURL"": """", ""text"": ""Shah Jahan was born in Lahore in fifteen-ninety-two, to a Mughal father and a Rajput mother. Akbar himself named the child Khurram — “the Joyous.” Raised by Ruqaiya Begam, Akbar’s childless wife, he grew up surrounded by scholars, poets, and Sufi mystics. Yet, his heart leaned toward the sword. By adolescence he rode like a warrior and wrote like a poet. He spoke Persian with the grace of a courtier and Hindavi with the warmth of a commoner. In him, two worlds met — the discipline of Timur and the spirit of India.""}"
taj-mahal1::6,0.0,taj-mahal1,"Picture Shah Jahan’s court in 1628. The emperor sits beneath the Peacock Throne, diamonds catching the lamplight. Around him stand his nobles in two perfect rows — a living mirror called qarina. Behind the emperor hangs a golden chain. It runs from his balcony to the courtyard below. Any common person could ring it to seek justice. At the emperor’s feet, artists paint lions and lambs together — symbols of power and peace. This was how Shah Jahan wished the world to see him: as ruler and sage, strong yet merciful, holding both sword and prayer in one hand.",,,"{""chapterId"": ""taj-mahal1"", ""createdAt"": ""2025-11-17T07:31:32.403502Z"", ""imageDesc"": """", ""imageURL"": """", ""text"": ""Picture Shah Jahan’s court in 1628. The emperor sits beneath the Peacock Throne, diamonds catching the lamplight. Around him stand his nobles in two perfect rows — a living mirror called qarina. Behind the emperor hangs a golden chain. It runs from his balcony to the courtyard below. Any common person could ring it to seek justice. At the emperor’s feet, artists paint lions and lambs together — symbols of power and peace. This was how Shah Jahan wished the world to see him: as ruler and sage, strong yet merciful, holding both sword and prayer in one hand.""}"
taj-mahal1::23,0.0,taj-mahal1,"Akbar believed truth had many voices. In fifteen eighty, he built the Ibadat Khana — the House of Worship — where scholars of every faith gathered to debate. Hindus, Muslims, Jains, Jesuit priests — all spoke before the emperor. He listened to each without anger, searching for what was common. He even had great Sanskrit works translated into Persian, so his court could learn from India’s wisdom. To him, tolerance was not weakness but power — the right to rule all mankind through understanding. “We regard the tribes of mankind,” he said, “as the servants of one God.” Those words became the soul of the Mughal empire.",,,"{""chapterId"": ""taj-mahal1"", ""createdAt"": ""2025-11-17T07:31:49.438626Z"", ""imageDesc"": """", ""imageURL"": """", ""text"": ""Akbar believed truth had many voices. In fifteen eighty, he built the Ibadat Khana — the House of Worship — where scholars of every faith gathered to debate. Hindus, Muslims, Jains, Jesuit priests — all spoke before the emperor. He listened to each without anger, searching for what was common. He even had great Sanskrit works translated into Persian, so his court could learn from India’s wisdom. To him, tolerance was not weakness but power — the right to rule all mankind through understanding. “We regard the tribes of mankind,” he said, “as the servants of one God.” Those words became the soul of the Mughal empire.""}"
taj-mahal1::50,0.0,taj-mahal1,"In June sixteen-thirty-one, Mumtaz Mahal gave birth to her fourteenth child in the fort of Burhanpur. Soon after, her pulse faltered. She sent for Shah Jahan, whispering her farewells. He held her hand as life slipped away. The emperor who ruled millions broke in silence. For seven days he vanished from court. Music stopped, perfumes faded, laughter died. He dressed in white, the color of mourning, and his eyes turned dim from tears. Witnesses wrote that even the sun over Burhanpur seemed to set early that day.",,,"{""chapterId"": ""taj-mahal1"", ""createdAt"": ""2025-11-17T07:32:13.586913Z"", ""imageDesc"": """", ""imageURL"": """", ""text"": ""In June sixteen-thirty-one, Mumtaz Mahal gave birth to her fourteenth child in the fort of Burhanpur. Soon after, her pulse faltered. She sent for Shah Jahan, whispering her farewells. He held her hand as life slipped away. The emperor who ruled millions broke in silence. For seven days he vanished from court. Music stopped, perfumes faded, laughter died. He dressed in white, the color of mourning, and his eyes turned dim from tears. Witnesses wrote that even the sun over Burhanpur seemed to set early that day.""}"
taj-mahal1::44,0.0,taj-mahal1,"Though centuries have passed, the spirit of the Mughals still walks through India. You see it in the arches of Delhi, the gardens of Kashmir, the marble of Agra. It lives in our languages, our poetry, our imagination. They turned rule into art and art into prayer. From Babur’s first garden to Shah Jahan’s last dome, their story is one continuous heartbeat — of ambition, creation, and remembrance. Empires may fall, but beauty remains. And so the Mughals never truly vanished; they became part of the world’s memory — eternal as the Taj Mahal itself.",,,"{""chapterId"": ""taj-mahal1"", ""createdAt"": ""2025-11-17T07:32:08.266126Z"", ""imageDesc"": """", ""imageURL"": """", ""text"": ""Though centuries have passed, the spirit of the Mughals still walks through India. You see it in the arches of Delhi, the gardens of Kashmir, the marble of Agra. It lives in our languages, our poetry, our imagination. They turned rule into art and art into prayer. From Babur’s first garden to Shah Jahan’s last dome, their story is one continuous heartbeat — of ambition, creation, and remembrance. Empires may fall, but beauty remains. And so the Mughals never truly vanished; they became part of the world’s memory — eternal as the Taj Mahal itself.""}"
taj-mahal1::54,0.0,taj-mahal1,"In his last years, imprisoned in Agra Fort by his own son, Shah Jahan would sit by a marble window and gaze at the Taj Mahal. The river carried the moonlight to its dome, and he whispered her name into the night. When he died, he was laid beside her, exactly as he had wished — their tombs equal in height and grace. Thus ended an empire’s greatest love story — a union so perfect that even in silence, marble speaks.",,,"{""chapterId"": ""taj-mahal1"", ""createdAt"": ""2025-11-17T07:32:16.868210Z"", ""imageDesc"": """", ""imageURL"": """", ""text"": ""In his last years, imprisoned in Agra Fort by his own son, Shah Jahan would sit by a marble window and gaze at the Taj Mahal. The river carried the moonlight to its dome, and he whispered her name into the night. When he died, he was laid beside her, exactly as he had wished — their tombs equal in height and grace. Thus ended an empire’s greatest love story — a union so perfect that even in silence, marble speaks.""}"
taj-mahal1::72,0.0,taj-mahal1,"The Hasht Bihisht reached its divine form in the Taj Mahal. Here, architecture became emotion. The ninefold plan, the central dome, the four iwans — all fused into harmony. The building was not only for a queen, but for the idea of perfection itself. Its geometry whispered of cosmic order; its marble shimmered like prayer. From Babur’s first pavilion to Shah Jahan’s Taj, the Mughals followed one belief — that to build with symmetry was to honor the Creator. And so they did.",,,"{""chapterId"": ""taj-mahal1"", ""createdAt"": ""2025-11-17T07:32:34.786199Z"", ""imageDesc"": """", ""imageURL"": """", ""text"": ""The Hasht Bihisht reached its divine form in the Taj Mahal. Here, architecture became emotion. The ninefold plan, the central dome, the four iwans — all fused into harmony. The building was not only for a queen, but for the idea of perfection itself. Its geometry whispered of cosmic order; its marble shimmered like prayer. From Babur’s first pavilion to Shah Jahan’s Taj, the Mughals followed one belief — that to build with symmetry was to honor the Creator. And so they did.""}"
taj-mahal1::17,0.0,taj-mahal1,"Back in India, Humayun dreamed of a court like the cosmos. He ordered a vast carpet to be woven with circles inside circles. Each noble had a place according to rank and origin, and in the centre sat the emperor — like the sun at the heart of the planets. The idea came from ancient Persian kings and their star thrones. To his courtiers, it looked eccentric. But to Humayun, it was a map of harmony — a universe in fabric, a reminder that order on earth should mirror the order of the heavens.",,,"{""chapterId"": ""taj-mahal1"", ""createdAt"": ""2025-11-17T07:31:44.309569Z"", ""imageDesc"": """", ""imageURL"": """", ""text"": ""Back in India, Humayun dreamed of a court like the cosmos. He ordered a vast carpet to be woven with circles inside circles. Each noble had a place according to rank and origin, and in the centre sat the emperor — like the sun at the heart of the planets. The idea came from ancient Persian kings and their star thrones. To his courtiers, it looked eccentric. But to Humayun, it was a map of harmony — a universe in fabric, a reminder that order on earth should mirror the order of the heavens.""}"
taj-mahal1::33,0.0,taj-mahal1,"Power and love made Shah Jahan great, but destiny turned his palace into a prison. When he fell ill in sixteen-fifty-seven, his sons fought for the throne. His beloved heir, Dara Shikoh — the poet and philosopher — was defeated by his brother Aurangzeb and publicly executed. The King of the World was imprisoned in Agra Fort, where he spent his last years looking at the Taj Mahal from his window. He died in sixteen-sixty-six, his body laid beside Mumtaz. The man who built the world’s greatest symbol of love died within its shadow — still a king, still a dreamer.",,,"{""chapterId"": ""taj-mahal1"", ""createdAt"": ""2025-11-17T07:31:58.652692Z"", ""imageDesc"": """", ""imageURL"": """", ""text"": ""Power and love made Shah Jahan great, but destiny turned his palace into a prison. When he fell ill in sixteen-fifty-seven, his sons fought for the throne. His beloved heir, Dara Shikoh — the poet and philosopher — was defeated by his brother Aurangzeb and publicly executed. The King of the World was imprisoned in Agra Fort, where he spent his last years looking at the Taj Mahal from his window. He died in sixteen-sixty-six, his body laid beside Mumtaz. The man who built the world’s greatest symbol of love died within its shadow — still a king, still a dreamer.""}"
taj-mahal1::82,0.0,taj-mahal1,"Gardens faded, ranks dissolved, and empires fell — yet the Mughal idea of beauty endured. The Yamuna’s banks still remember the men who once held titles of seven thousand and the poets who wrote for their fountains. The emperor’s signature may have vanished, but the scent of order and grandeur lingers in Agra’s dust. For in every Mughal garden, whether lost or restored, the same truth survives — that creation, like power, belongs only to those who understand its impermanence.",,,"{""chapterId"": ""taj-mahal1"", ""createdAt"": ""2025-11-17T07:32:42.980015Z"", ""imageDesc"": """", ""imageURL"": """", ""text"": ""Gardens faded, ranks dissolved, and empires fell — yet the Mughal idea of beauty endured. The Yamuna’s banks still remember the men who once held titles of seven thousand and the poets who wrote for their fountains. The emperor’s signature may have vanished, but the scent of order and grandeur lingers in Agra’s dust. For in every Mughal garden, whether lost or restored, the same truth survives — that creation, like power, belongs only to those who understand its impermanence.""}"
taj-mahal1::88,0.0,taj-mahal1,"Around the same years, the tomb of I‘timad-ud-Daula rose within a classic chahar bagh: a hasht-bihisht pavilion at the center, cross-axes, water channels, and gates at the walls. This became the funerary norm for riverfront Agra—until the Taj. The design said something tender and bold: that the faithful departed should rest where water flows and gardens bloom, the earthly image of the Paradise promised beyond.",,,"{""chapterId"": ""taj-mahal1"", ""createdAt"": ""2025-11-17T07:32:48.512002Z"", ""imageDesc"": """", ""imageURL"": """", ""text"": ""Around the same years, the tomb of I‘timad-ud-Daula rose within a classic chahar bagh: a hasht-bihisht pavilion at the center, cross-axes, water channels, and gates at the walls. This became the funerary norm for riverfront Agra—until the Taj. The design said something tender and bold: that the faithful departed should rest where water flows and gardens bloom, the earthly image of the Paradise promised beyond.""}"
taj-mahal1::95,0.0,taj-mahal1,"In 1648, Shah Jahan moved his throne to Delhi, to his new city of Shahjahanabad. Agra — once the “Seat of the Caliphate” — was left as its shadow, the “Settled Abode.” The gardens by the Yamuna stood quiet, their owners gone north. And in those silent terraces, you can almost hear the sound of caravans departing, of fountains drying. Power had shifted up the river, and Agra became a memory watching itself fade.",,,"{""chapterId"": ""taj-mahal1"", ""createdAt"": ""2025-11-17T07:32:54.758520Z"", ""imageDesc"": """", ""imageURL"": """", ""text"": ""In 1648, Shah Jahan moved his throne to Delhi, to his new city of Shahjahanabad. Agra — once the “Seat of the Caliphate” — was left as its shadow, the “Settled Abode.” The gardens by the Yamuna stood quiet, their owners gone north. And in those silent terraces, you can almost hear the sound of caravans departing, of fountains drying. Power had shifted up the river, and Agra became a memory watching itself fade.""}"
taj-mahal1::99,0.0,taj-mahal1,"As palaces faded, people took the river for their own. By the 1700s, Agra had become a city of swimmers. Men, women, children — rich and poor — all gathered in the monsoon for the Triveni festival. They honored Khwaja Khizr, the saint of water, and Krishna, lord of play. Paper lions floated; fireworks burned on effigies of Kanhaiya Lal Jiu. The air smelled of sweets and wet earth. Once a symbol of power, the Yamuna had become a playground of faith and joy.",,,"{""chapterId"": ""taj-mahal1"", ""createdAt"": ""2025-11-17T07:32:59.056085Z"", ""imageDesc"": """", ""imageURL"": """", ""text"": ""As palaces faded, people took the river for their own. By the 1700s, Agra had become a city of swimmers. Men, women, children — rich and poor — all gathered in the monsoon for the Triveni festival. They honored Khwaja Khizr, the saint of water, and Krishna, lord of play. Paper lions floated; fireworks burned on effigies of Kanhaiya Lal Jiu. The air smelled of sweets and wet earth. Once a symbol of power, the Yamuna had become a playground of faith and joy.""}"
taj-mahal1::94,0.0,taj-mahal1,"Other empires loved water too. Ottoman Istanbul lined the Bosphorus with villas; Safavid Isfahan set gardens on the Zayandeh. But Agra’s riverfront was tighter, more systematic, more uniform—a Mughal logic of order. It became the city’s very core, with most of the urban fabric tucked inland. Even when Shah Jahan planned bazaars, a mosque, and wider streets, the river remained the star. Agra was not built beside gardens; Agra was a garden, written along a shining page of water.",,,"{""chapterId"": ""taj-mahal1"", ""createdAt"": ""2025-11-17T07:32:53.938185Z"", ""imageDesc"": """", ""imageURL"": """", ""text"": ""Other empires loved water too. Ottoman Istanbul lined the Bosphorus with villas; Safavid Isfahan set gardens on the Zayandeh. But Agra’s riverfront was tighter, more systematic, more uniform—a Mughal logic of order. It became the city’s very core, with most of the urban fabric tucked inland. Even when Shah Jahan planned bazaars, a mosque, and wider streets, the river remained the star. Agra was not built beside gardens; Agra was a garden, written along a shining page of water.""}"
taj-mahal1::16,0.0,taj-mahal1,"Humayun believed a king should shine like the sun. When he sat on his throne, he covered his crown with a veil. When he lifted it, the people cried, “Light has shone forth!” It was his way of saying that the emperor was the second sun — the one on earth. This idea came from ancient Persian legends of Jamshid, the mythical king who turned his golden throne toward the rising sun. Humayun revived that myth in India — uniting faith and light, spirit and power. To his people, he was not just ruler of a kingdom, but the brilliance that held their world together.",,,"{""chapterId"": ""taj-mahal1"", ""createdAt"": ""2025-11-17T07:31:42.592236Z"", ""imageDesc"": """", ""imageURL"": """", ""text"": ""Humayun believed a king should shine like the sun. When he sat on his throne, he covered his crown with a veil. When he lifted it, the people cried, “Light has shone forth!” It was his way of saying that the emperor was the second sun — the one on earth. This idea came from ancient Persian legends of Jamshid, the mythical king who turned his golden throne toward the rising sun. Humayun revived that myth in India — uniting faith and light, spirit and power. To his people, he was not just ruler of a kingdom, but the brilliance that held their world together.""}"
taj-mahal1::18,0.0,taj-mahal1,"During his years in Iran, Humayun met the great painters of Shah Tahmasp’s court — Mir Sayyid Ali and Abdus Samad. When he returned to Kabul in fifteen-forty-nine, he brought them with him. These artists later served his son Akbar, creating the famous Mughal style of painting — a fusion of Persian elegance, Central Asian detail, Indian colour, and European perspective. Every brush stroke was a bridge between civilizations. In those palace studios, the story of India was painted anew — bright, curious, alive with the energy of many worlds.",,,"{""chapterId"": ""taj-mahal1"", ""createdAt"": ""2025-11-17T07:31:45.243070Z"", ""imageDesc"": """", ""imageURL"": """", ""text"": ""During his years in Iran, Humayun met the great painters of Shah Tahmasp’s court — Mir Sayyid Ali and Abdus Samad. When he returned to Kabul in fifteen-forty-nine, he brought them with him. These artists later served his son Akbar, creating the famous Mughal style of painting — a fusion of Persian elegance, Central Asian detail, Indian colour, and European perspective. Every brush stroke was a bridge between civilizations. In those palace studios, the story of India was painted anew — bright, curious, alive with the energy of many worlds.""}"
taj-mahal1::22,0.0,taj-mahal1,"Akbar was a dreamer in stone. He built forts, palaces, mosques, and tombs across India — all glowing in red sandstone with streaks of white marble. His architecture blended the power of Central Asia with the warmth of India. Every arch, dome, and pillar spoke of harmony. Look at Fatehpur Sikri — his city of victory. It is both fortress and poem, both science and art. Akbar’s buildings were his way of saying that beauty could unite worlds just as faith could unite hearts.",,,"{""chapterId"": ""taj-mahal1"", ""createdAt"": ""2025-11-17T07:31:48.662898Z"", ""imageDesc"": """", ""imageURL"": """", ""text"": ""Akbar was a dreamer in stone. He built forts, palaces, mosques, and tombs across India — all glowing in red sandstone with streaks of white marble. His architecture blended the power of Central Asia with the warmth of India. Every arch, dome, and pillar spoke of harmony. Look at Fatehpur Sikri — his city of victory. It is both fortress and poem, both science and art. Akbar’s buildings were his way of saying that beauty could unite worlds just as faith could unite hearts.""}"
taj-mahal1::52,0.0,taj-mahal1,"Months later, her body was carried in a grand procession from Burhanpur to Agra. Princes, poets, and pilgrims followed the caravan. Along the Yamuna, Shah Jahan chose a garden where the river curved like a crescent moon. “Here,” he said, “Paradise shall rise.” There, under white canopies, the builders of fate began their work — to turn sorrow into symmetry, and loss into light.",,,"{""chapterId"": ""taj-mahal1"", ""createdAt"": ""2025-11-17T07:32:15.234172Z"", ""imageDesc"": """", ""imageURL"": """", ""text"": ""Months later, her body was carried in a grand procession from Burhanpur to Agra. Princes, poets, and pilgrims followed the caravan. Along the Yamuna, Shah Jahan chose a garden where the river curved like a crescent moon. “Here,” he said, “Paradise shall rise.” There, under white canopies, the builders of fate began their work — to turn sorrow into symmetry, and loss into light.""}"
taj-mahal1::55,0.0,taj-mahal1,"“What a city!” wrote the poet Talib Kalim. “A perfumed garden, newly in flower — its buildings tall as cypress trees.” This was Agra in the seventeenth century — or as the Mughals called it, Akbarabad. The air smelled of rosewater and sandalwood. Fountains sparkled beside red sandstone mansions. Poets recited by moonlight, and the river carried their voices from one palace to another. Agra was not a city of walls, but of gardens — each one a dream stitched to the next. And in its heart, beside the sacred Yamuna, Shah Jahan would raise his eternal bloom: the Taj Mahal.",,,"{""chapterId"": ""taj-mahal1"", ""createdAt"": ""2025-11-17T07:32:17.686067Z"", ""imageDesc"": """", ""imageURL"": """", ""text"": ""“What a city!” wrote the poet Talib Kalim. “A perfumed garden, newly in flower — its buildings tall as cypress trees.” This was Agra in the seventeenth century — or as the Mughals called it, Akbarabad. The air smelled of rosewater and sandalwood. Fountains sparkled beside red sandstone mansions. Poets recited by moonlight, and the river carried their voices from one palace to another. Agra was not a city of walls, but of gardens — each one a dream stitched to the next. And in its heart, beside the sacred Yamuna, Shah Jahan would raise his eternal bloom: the Taj Mahal.""}"
taj-mahal1::70,0.0,taj-mahal1,"In Agra, the Hasht Bihisht met the river. Shah Jahan placed his pavilions along the Yamuna, their open arches facing water. Beneath them were cool chambers, half hidden, half bright. The Red Fort’s riverfront halls followed this pattern — domed pavilions flanked by towers, blending garden with palace. When seen from a boat, the symmetry was breathtaking: every building mirrored in the water, like heaven gazing at itself. This was Mughal architecture’s purest vision — beauty reflected upon beauty.",,,"{""chapterId"": ""taj-mahal1"", ""createdAt"": ""2025-11-17T07:32:33.159593Z"", ""imageDesc"": """", ""imageURL"": """", ""text"": ""In Agra, the Hasht Bihisht met the river. Shah Jahan placed his pavilions along the Yamuna, their open arches facing water. Beneath them were cool chambers, half hidden, half bright. The Red Fort’s riverfront halls followed this pattern — domed pavilions flanked by towers, blending garden with palace. When seen from a boat, the symmetry was breathtaking: every building mirrored in the water, like heaven gazing at itself. This was Mughal architecture’s purest vision — beauty reflected upon beauty.""}"
taj-mahal1::56,0.0,taj-mahal1,"The Yamuna was more than a river — it was Agra’s lifeline, its shining spine. Along its banks stretched rows of gardens, tombs, and palaces. From a boat, one could glide past the mansions of nobles, the marble terraces of princes, and the shrines of saints. Every palace opened to the water like a mirror to the heavens. For the Mughals, the river was divine — both practical and poetic. It joined the city’s soul with its landscape, turning Agra into what the poet Kalim called “a necklace of paradise gardens.”",,,"{""chapterId"": ""taj-mahal1"", ""createdAt"": ""2025-11-17T07:32:18.508020Z"", ""imageDesc"": """", ""imageURL"": """", ""text"": ""The Yamuna was more than a river — it was Agra’s lifeline, its shining spine. Along its banks stretched rows of gardens, tombs, and palaces. From a boat, one could glide past the mansions of nobles, the marble terraces of princes, and the shrines of saints. Every palace opened to the water like a mirror to the heavens. For the Mughals, the river was divine — both practical and poetic. It joined the city’s soul with its landscape, turning Agra into what the poet Kalim called “a necklace of paradise gardens.”""}"
