id,score,chapterId,text,imageDesc,imageURL,metadata_json
taj-mahal1::164,0.0,taj-mahal1,"Akbar built his father Humayun a palace for eternity. Set in a charbagh, it was the first Indian garden-tomb. Architect Sayyid Muhammad of Herat multiplied the Timurid “eight paradises” into a new cosmic grid: red sandstone, white marble ribs, a dome like an echo of Samarkand. Beneath, the true grave lies in shadow; above, a symbolic one glows with light. The double structure meant body and soul, earth and heaven. Every later Mughal mausoleum—including the Taj—grew from this idea: that paradise could be mapped in stone and walked upon by mourners.",,,"{""chapterId"": ""taj-mahal1"", ""createdAt"": ""2025-11-17T07:44:19.198685Z"", ""imageDesc"": """", ""imageURL"": """", ""text"": ""Akbar built his father Humayun a palace for eternity. Set in a charbagh, it was the first Indian garden-tomb. Architect Sayyid Muhammad of Herat multiplied the Timurid “eight paradises” into a new cosmic grid: red sandstone, white marble ribs, a dome like an echo of Samarkand. Beneath, the true grave lies in shadow; above, a symbolic one glows with light. The double structure meant body and soul, earth and heaven. Every later Mughal mausoleum—including the Taj—grew from this idea: that paradise could be mapped in stone and walked upon by mourners.""}"
taj-mahal1::127,0.0,taj-mahal1,"“Red Garden.” Perhaps sandstone terraces glowing at sunset; perhaps a favorite of evening durbars. Nothing remains, but the name still colors the air.",,,"{""chapterId"": ""taj-mahal1"", ""createdAt"": ""2025-11-17T07:33:36.739172Z"", ""imageDesc"": """", ""imageURL"": """", ""text"": ""“Red Garden.” Perhaps sandstone terraces glowing at sunset; perhaps a favorite of evening durbars. Nothing remains, but the name still colors the air.""}"
taj-mahal1::121,0.0,taj-mahal1,"Jahangir’s son Parwiz—Dara Shikoh’s future father-in-law—died in Burhanpur; his tomb rose here on the left bank. The garden is gone, but the cube-and-dome structure remains over vaulted subrooms laid out in a simple hasht-bihisht logic. Inside, a Shahjahani net vault of qalib-kari lingers in patches of plaster and paint. Locals know it more than tourists do. Approach from the lane, and you feel the Mughal habit: even minor tombs are little essays on proportion.",,,"{""chapterId"": ""taj-mahal1"", ""createdAt"": ""2025-11-17T07:33:31.825527Z"", ""imageDesc"": """", ""imageURL"": """", ""text"": ""Jahangir’s son Parwiz—Dara Shikoh’s future father-in-law—died in Burhanpur; his tomb rose here on the left bank. The garden is gone, but the cube-and-dome structure remains over vaulted subrooms laid out in a simple hasht-bihisht logic. Inside, a Shahjahani net vault of qalib-kari lingers in patches of plaster and paint. Locals know it more than tourists do. Approach from the lane, and you feel the Mughal habit: even minor tombs are little essays on proportion.""}"
taj-mahal1::158,0.0,taj-mahal1,"Lahauri called them “mute eloquence.” He meant that Shah Jahan’s palaces spoke long after the emperor fell silent. Their symmetry, he wrote, expressed purity and high aspiration—the way the sun expresses light. Each column praised order; each dome whispered authority. In this peaceful reign, he said, the art of building astonished even world travelers. To stand before such geometry was to feel hierarchy and serenity merged. Even now, these stones continue their speech, the kind you hear not with ears but with balance—the language of proportion.",,,"{""chapterId"": ""taj-mahal1"", ""createdAt"": ""2025-11-17T07:44:13.047015Z"", ""imageDesc"": """", ""imageURL"": """", ""text"": ""Lahauri called them “mute eloquence.” He meant that Shah Jahan’s palaces spoke long after the emperor fell silent. Their symmetry, he wrote, expressed purity and high aspiration—the way the sun expresses light. Each column praised order; each dome whispered authority. In this peaceful reign, he said, the art of building astonished even world travelers. To stand before such geometry was to feel hierarchy and serenity merged. Even now, these stones continue their speech, the kind you hear not with ears but with balance—the language of proportion.""}"
taj-mahal1::135,0.0,taj-mahal1,"Nephew to Nur Jahan, brother to Mumtaz—Shayista Khan sat at the crossroads of blood and bureaucracy. He backed Aurangzeb during the succession crisis and rose to amir-ul-umara. Governor of the Deccan, then Bengal, then Agra—his wealth became legend. His Agra haveli stood by Aurangzeb’s complex, a neighbor to history. He built roads, sarais, and works for the public; Tieffenthaler credited him with city walls. In court ritual he earned a rare privilege: to bring his palanquin into the Hall of Private Audience. The house is gone, but the story lingers: sometimes the builder outlasts the general.",,,"{""chapterId"": ""taj-mahal1"", ""createdAt"": ""2025-11-17T07:43:46.425056Z"", ""imageDesc"": """", ""imageURL"": """", ""text"": ""Nephew to Nur Jahan, brother to Mumtaz—Shayista Khan sat at the crossroads of blood and bureaucracy. He backed Aurangzeb during the succession crisis and rose to amir-ul-umara. Governor of the Deccan, then Bengal, then Agra—his wealth became legend. His Agra haveli stood by Aurangzeb’s complex, a neighbor to history. He built roads, sarais, and works for the public; Tieffenthaler credited him with city walls. In court ritual he earned a rare privilege: to bring his palanquin into the Hall of Private Audience. The house is gone, but the story lingers: sometimes the builder outlasts the general.""}"
taj-mahal1::128,0.0,taj-mahal1,"One is simply “Chahar-Bagh Padshahi,” the other “Second Chahar-Bagh.” Their ancestor is Babur’s own Bagh-i Hasht Bihisht—India’s first Mughal charbagh by the river. Babur lists a great well, an octagonal pool, stone halls, a wooden talar, and a private khilwat garden. Only wells survive—but in his prose you can still smell musk rose and geometry.",,,"{""chapterId"": ""taj-mahal1"", ""createdAt"": ""2025-11-17T07:33:37.557530Z"", ""imageDesc"": """", ""imageURL"": """", ""text"": ""One is simply “Chahar-Bagh Padshahi,” the other “Second Chahar-Bagh.” Their ancestor is Babur’s own Bagh-i Hasht Bihisht—India’s first Mughal charbagh by the river. Babur lists a great well, an octagonal pool, stone halls, a wooden talar, and a private khilwat garden. Only wells survive—but in his prose you can still smell musk rose and geometry.""}"
taj-mahal1::133,0.0,taj-mahal1,"Father of Mumtaz Mahal. Brother of Nur Jahan. Shah Jahan’s “Right Hand of the Empire.” Asaf Khan’s riverside mansion was a second court. Jahangir loved its hammam: hot, perfumed, tiled, a winter sun in steam. Later writers swore a great pillared hall matched the emperor’s own Audience Hall. Servants were famously well kept; the kitchens knew every spice note of the empire. In 1857 the British blew up what remained, fearing a rebel redoubt—proof that even ruins can threaten. Think of the Nishat Bagh in Kashmir with nine terraces; then shrink that grandeur to a single hall and set it here, by the Yamuna’s slow glass.",,,"{""chapterId"": ""taj-mahal1"", ""createdAt"": ""2025-11-17T07:43:43.705278Z"", ""imageDesc"": """", ""imageURL"": """", ""text"": ""Father of Mumtaz Mahal. Brother of Nur Jahan. Shah Jahan’s “Right Hand of the Empire.” Asaf Khan’s riverside mansion was a second court. Jahangir loved its hammam: hot, perfumed, tiled, a winter sun in steam. Later writers swore a great pillared hall matched the emperor’s own Audience Hall. Servants were famously well kept; the kitchens knew every spice note of the empire. In 1857 the British blew up what remained, fearing a rebel redoubt—proof that even ruins can threaten. Think of the Nishat Bagh in Kashmir with nine terraces; then shrink that grandeur to a single hall and set it here, by the Yamuna’s slow glass.""}"
taj-mahal1::161,0.0,taj-mahal1,"Every masterpiece had its scribe. Lahauri, Kanbo, Abu Talib Kalim, Qudsi—they described the Taj and the forts as if chronicling battles of beauty. Shah Jahan personally reviewed their texts, ensuring each metaphor served the throne. Thus history and architecture merged: poetry gave the marble a voice; the marble gave the poetry proof. When Lahauri wrote that “the Taj Mahal astonishes the world traveler hard to please,” he wasn’t exaggerating—he was completing the building with words. For Shah Jahan, legacy meant literature carved in both ink and stone.",,,"{""chapterId"": ""taj-mahal1"", ""createdAt"": ""2025-11-17T07:44:15.917591Z"", ""imageDesc"": """", ""imageURL"": """", ""text"": ""Every masterpiece had its scribe. Lahauri, Kanbo, Abu Talib Kalim, Qudsi—they described the Taj and the forts as if chronicling battles of beauty. Shah Jahan personally reviewed their texts, ensuring each metaphor served the throne. Thus history and architecture merged: poetry gave the marble a voice; the marble gave the poetry proof. When Lahauri wrote that “the Taj Mahal astonishes the world traveler hard to please,” he wasn’t exaggerating—he was completing the building with words. For Shah Jahan, legacy meant literature carved in both ink and stone.""}"
taj-mahal1::184,0.0,taj-mahal1,"By the mid-nineteenth century, parchin kari in Agra had nearly fallen silent. Stones were missing from vines; skills were slipping away. Then a doctor with a camera—John Murray, an early photographer of the Taj—helped revive the craft. Workshops stirred again, teaching measured cuts, wet saws, and the old patience. Today, conservation teams still replace lost leaves and petals using Mughal methods. You’ll see the posture, the bow-saw, the abrasives, the slow polish to an invisible seam. The Taj keeps its promise: not only to endure, but to keep the knowledge of hands alive.",,,"{""chapterId"": ""taj-mahal1"", ""createdAt"": ""2025-11-17T07:44:42.131274Z"", ""imageDesc"": """", ""imageURL"": """", ""text"": ""By the mid-nineteenth century, parchin kari in Agra had nearly fallen silent. Stones were missing from vines; skills were slipping away. Then a doctor with a camera—John Murray, an early photographer of the Taj—helped revive the craft. Workshops stirred again, teaching measured cuts, wet saws, and the old patience. Today, conservation teams still replace lost leaves and petals using Mughal methods. You’ll see the posture, the bow-saw, the abrasives, the slow polish to an invisible seam. The Taj keeps its promise: not only to endure, but to keep the knowledge of hands alive.""}"
taj-mahal1::116,0.0,taj-mahal1,"Jahangir’s “Light-Scattering” garden—likely on Babur’s older foundations—mixes river terrace with landward chahar-bagh. Water chutes with fish-scale carving step down to a 3×2 grid of raised walks; beneath the terrace, cool tahkhana rooms and a hammam with bangla vaults whisper of summers escaped. Two slim pavilions face each other across a pool; their peacock brackets, muqarnas capitals, and painted angels and birds hint at Nur Jahan’s taste and Jahangir’s love of nature. Later the British honeymooned here; the paintings resurfaced under lime.",,,"{""chapterId"": ""taj-mahal1"", ""createdAt"": ""2025-11-17T07:33:26.909096Z"", ""imageDesc"": """", ""imageURL"": """", ""text"": ""Jahangir’s “Light-Scattering” garden—likely on Babur’s older foundations—mixes river terrace with landward chahar-bagh. Water chutes with fish-scale carving step down to a 3×2 grid of raised walks; beneath the terrace, cool tahkhana rooms and a hammam with bangla vaults whisper of summers escaped. Two slim pavilions face each other across a pool; their peacock brackets, muqarnas capitals, and painted angels and birds hint at Nur Jahan’s taste and Jahangir’s love of nature. Later the British honeymooned here; the paintings resurfaced under lime.""}"
taj-mahal1::120,0.0,taj-mahal1,"Physician, governor, patron—Wazir Khan escorted Mumtaz’s body back to Agra. His garden’s riverfront survives best among non-imperial sites: a central pavilion over a tahkhana, red-sandstone arcades, and towers bracketing the terrace—pure Shahjahani rhythm, probably 1640s. Sil Chand noted an octagonal platform mid-garden; the 1860s map shows a circular trace. Today, ruins. But the plan still reads like music: center-pause-center, a composition for shade, breeze, and rank.",,,"{""chapterId"": ""taj-mahal1"", ""createdAt"": ""2025-11-17T07:33:30.801225Z"", ""imageDesc"": """", ""imageURL"": """", ""text"": ""Physician, governor, patron—Wazir Khan escorted Mumtaz’s body back to Agra. His garden’s riverfront survives best among non-imperial sites: a central pavilion over a tahkhana, red-sandstone arcades, and towers bracketing the terrace—pure Shahjahani rhythm, probably 1640s. Sil Chand noted an octagonal platform mid-garden; the 1860s map shows a circular trace. Today, ruins. But the plan still reads like music: center-pause-center, a composition for shade, breeze, and rank.""}"
taj-mahal1::115,0.0,taj-mahal1,"Next to Buland Bagh runs a long, narrow complex: gates at both ends, an open lane, rows of small hujra rooms under arcades. Think of it as the garden’s supply chain—vendors, carpenters, fruit sellers—everything a riverfront palace needed. In the 1920s it was a cattle yard. Before that? A humming corridor where flowers, perfumes, and festival lamps changed hands. Mughal gardens didn’t float on poetry alone; they ran on logistics—and this was the backstage.",,,"{""chapterId"": ""taj-mahal1"", ""createdAt"": ""2025-11-17T07:33:26.099303Z"", ""imageDesc"": """", ""imageURL"": """", ""text"": ""Next to Buland Bagh runs a long, narrow complex: gates at both ends, an open lane, rows of small hujra rooms under arcades. Think of it as the garden’s supply chain—vendors, carpenters, fruit sellers—everything a riverfront palace needed. In the 1920s it was a cattle yard. Before that? A humming corridor where flowers, perfumes, and festival lamps changed hands. Mughal gardens didn’t float on poetry alone; they ran on logistics—and this was the backstage.""}"
taj-mahal1::137,0.0,taj-mahal1,"The Jaipur map shows a square, domed tomb on the riverfront attributed to Shayista Khan; later writers point to a similar building farther upstream near a small mosque. Did the mapmaker slide his brush too far north? Either way, a red-sandstone cube with a calm dome once anchored this bank, turning a statesman’s lifetime of paperwork into a single, legible shape. If you pass the bypass road today, glance right: the past sometimes reappears as a dome between trucks.",,,"{""chapterId"": ""taj-mahal1"", ""createdAt"": ""2025-11-17T07:43:49.715089Z"", ""imageDesc"": """", ""imageURL"": """", ""text"": ""The Jaipur map shows a square, domed tomb on the riverfront attributed to Shayista Khan; later writers point to a similar building farther upstream near a small mosque. Did the mapmaker slide his brush too far north? Either way, a red-sandstone cube with a calm dome once anchored this bank, turning a statesman’s lifetime of paperwork into a single, legible shape. If you pass the bypass road today, glance right: the past sometimes reappears as a dome between trucks.""}"
taj-mahal1::143,0.0,taj-mahal1,"Opposite Ram Bagh stands Ja‘far Khan’s tomb garden: a square pavilion with five-arched verandahs on each side, corner towers, and an inner sanctum—late-Mughal in dress, old-Mughal in soul. Ja‘far served as governor, paymaster, intelligence chief, and, finally, finance minister; then he served Aurangzeb too. The tomb’s piers wear flame-leaf capitals first seen in Delhi’s Red Fort. Today the arches are bricked in and the building stores government gear, but step back to the river edge and read the elevation: it still pronounces a hasht-bihisht accent—eight paradises surrounding duty’s calm center.",,,"{""chapterId"": ""taj-mahal1"", ""createdAt"": ""2025-11-17T07:43:56.401137Z"", ""imageDesc"": """", ""imageURL"": """", ""text"": ""Opposite Ram Bagh stands Ja‘far Khan’s tomb garden: a square pavilion with five-arched verandahs on each side, corner towers, and an inner sanctum—late-Mughal in dress, old-Mughal in soul. Ja‘far served as governor, paymaster, intelligence chief, and, finally, finance minister; then he served Aurangzeb too. The tomb’s piers wear flame-leaf capitals first seen in Delhi’s Red Fort. Today the arches are bricked in and the building stores government gear, but step back to the river edge and read the elevation: it still pronounces a hasht-bihisht accent—eight paradises surrounding duty’s calm center.""}"
taj-mahal1::193,0.0,taj-mahal1,"Building materials in Shah Jahan’s time weren’t just mixed—they were blessed. Lime was slaked with milk, sugar, and the juice of sacred bael fruit, stirred with wooden paddles while workers sang. The mixture cured for days, growing stronger with every prayer whispered into it. To finish, artisans polished the plaster with agates for hours, until it reflected faces like mirrors. This wasn’t construction—it was ritual. Fire made brick; milk made shine; and between them, an empire made eternity tangible. Every polished wall of the Taj Mahal still carries that ancient recipe for permanence.",,,"{""chapterId"": ""taj-mahal1"", ""createdAt"": ""2025-11-17T07:44:51.979999Z"", ""imageDesc"": """", ""imageURL"": """", ""text"": ""Building materials in Shah Jahan’s time weren’t just mixed—they were blessed. Lime was slaked with milk, sugar, and the juice of sacred bael fruit, stirred with wooden paddles while workers sang. The mixture cured for days, growing stronger with every prayer whispered into it. To finish, artisans polished the plaster with agates for hours, until it reflected faces like mirrors. This wasn’t construction—it was ritual. Fire made brick; milk made shine; and between them, an empire made eternity tangible. Every polished wall of the Taj Mahal still carries that ancient recipe for permanence.""}"
taj-mahal1::198,0.0,taj-mahal1,"Beneath the marble and sandstone façades are iron dowels and clamps locking every slab into place. The masons knew rust was the enemy of eternity, so they sealed each joint with lead and lime. Domes, terraces, and walls follow one rule: marble for the sacred, sandstone for the strong. Even the flanking mosque and guesthouse balance red and white, echoing sunrise and moonlight. Time has tested every joint—earthquakes, floods, heat—and yet the surfaces still fit like calligraphy. The Taj’s beauty is not only skin-deep; it’s a skeleton of precision disguised as grace.",,,"{""chapterId"": ""taj-mahal1"", ""createdAt"": ""2025-11-17T07:44:58.211550Z"", ""imageDesc"": """", ""imageURL"": """", ""text"": ""Beneath the marble and sandstone façades are iron dowels and clamps locking every slab into place. The masons knew rust was the enemy of eternity, so they sealed each joint with lead and lime. Domes, terraces, and walls follow one rule: marble for the sacred, sandstone for the strong. Even the flanking mosque and guesthouse balance red and white, echoing sunrise and moonlight. Time has tested every joint—earthquakes, floods, heat—and yet the surfaces still fit like calligraphy. The Taj’s beauty is not only skin-deep; it’s a skeleton of precision disguised as grace.""}"
taj-mahal1::106,0.0,taj-mahal1,"On the Jaipur map, the Yamuna enters from the north and flows past alternating worlds — baghs on the left bank, havelis on the right. The Persian and Arabic words reveal meaning: bagh for garden, haveli for residence, rauza for a saint’s tomb, maqbara for a noble’s. The left bank held the emperor’s and the women’s gardens; the right bank, the princes and ministers. Every building leaned toward the water, as if drawn by the same current of grace.",,,"{""chapterId"": ""taj-mahal1"", ""createdAt"": ""2025-11-17T07:33:14.060653Z"", ""imageDesc"": """", ""imageURL"": """", ""text"": ""On the Jaipur map, the Yamuna enters from the north and flows past alternating worlds — baghs on the left bank, havelis on the right. The Persian and Arabic words reveal meaning: bagh for garden, haveli for residence, rauza for a saint’s tomb, maqbara for a noble’s. The left bank held the emperor’s and the women’s gardens; the right bank, the princes and ministers. Every building leaned toward the water, as if drawn by the same current of grace.""}"
taj-mahal1::149,0.0,taj-mahal1,"Calligraphers traced Qur’anic light. Inlayers cut jasper and jade into vines. Carvers softened marble like cloth. Metalworkers forged clamps; brickmakers fed kilns night and day. Water-engineers lifted Yamuna water by wheel to channels and tanks on the terrace. Every trade set up its own yard, its own fire, its own rhythm. Foremen handled wages; court overseers handled quality. Walk the complex today and you can still feel their choreography—thousands of hands, one tempo. The emperor gave the tempo; the guilds wrote the music.",,,"{""chapterId"": ""taj-mahal1"", ""createdAt"": ""2025-11-17T07:44:03.603593Z"", ""imageDesc"": """", ""imageURL"": """", ""text"": ""Calligraphers traced Qur’anic light. Inlayers cut jasper and jade into vines. Carvers softened marble like cloth. Metalworkers forged clamps; brickmakers fed kilns night and day. Water-engineers lifted Yamuna water by wheel to channels and tanks on the terrace. Every trade set up its own yard, its own fire, its own rhythm. Foremen handled wages; court overseers handled quality. Walk the complex today and you can still feel their choreography—thousands of hands, one tempo. The emperor gave the tempo; the guilds wrote the music.""}"
taj-mahal1::187,0.0,taj-mahal1,"The Taj’s sandstone—sang-i surkh—came from hills near Fatehpur Sikri and Rupbas. It glows soft red to honey-yellow, carved so finely that Akbar’s historian said, “Workmen chisel it better than turners shape wood.” Even today, the road from Jaipur to Agra hums with its echo—workshops slicing “Agra stone” on whirring saws, carving it by hand. In Shah Jahan’s time, each block was shaped with hammer and heart. Sandstone built not just walls, but rhythm—the rhythmic contrast to marble’s silence. Together they sang the empire’s color duet: red for power, white for purity, joined forever in stone.",,,"{""chapterId"": ""taj-mahal1"", ""createdAt"": ""2025-11-17T07:44:45.815483Z"", ""imageDesc"": """", ""imageURL"": """", ""text"": ""The Taj’s sandstone—sang-i surkh—came from hills near Fatehpur Sikri and Rupbas. It glows soft red to honey-yellow, carved so finely that Akbar’s historian said, “Workmen chisel it better than turners shape wood.” Even today, the road from Jaipur to Agra hums with its echo—workshops slicing “Agra stone” on whirring saws, carving it by hand. In Shah Jahan’s time, each block was shaped with hammer and heart. Sandstone built not just walls, but rhythm—the rhythmic contrast to marble’s silence. Together they sang the empire’s color duet: red for power, white for purity, joined forever in stone.""}"
taj-mahal1::101,0.0,taj-mahal1,"When the British took Agra in 1803, the Triveni still shimmered, but the gardens crumbled. Walls were torn for roads, terraces for bungalows. Ironically, the new rulers came as preservers, yet became the agents of disappearance. They mapped the city, dug its ruins, and inadvertently unraveled its design. By the 19th century, the riverfront had lost its rhythm — its music muted by good intentions.",,,"{""chapterId"": ""taj-mahal1"", ""createdAt"": ""2025-11-17T07:33:08.992394Z"", ""imageDesc"": """", ""imageURL"": """", ""text"": ""When the British took Agra in 1803, the Triveni still shimmered, but the gardens crumbled. Walls were torn for roads, terraces for bungalows. Ironically, the new rulers came as preservers, yet became the agents of disappearance. They mapped the city, dug its ruins, and inadvertently unraveled its design. By the 19th century, the riverfront had lost its rhythm — its music muted by good intentions.""}"
taj-mahal1::123,0.0,taj-mahal1,"A senior sadr under Shah Jahan, Musawi Khan’s river residence once showed a palace with vaults below and a fine mosque. Records praise his courtesy more than his learning—proof that manners were a Mughal credential. The site is now the Moti Bagh colony. If you’re mapping for Kabir, tag this as a “memory coordinate” and play the sound of footsteps over brick vaults that no longer exist.",,,"{""chapterId"": ""taj-mahal1"", ""createdAt"": ""2025-11-17T07:33:33.464014Z"", ""imageDesc"": """", ""imageURL"": """", ""text"": ""A senior sadr under Shah Jahan, Musawi Khan’s river residence once showed a palace with vaults below and a fine mosque. Records praise his courtesy more than his learning—proof that manners were a Mughal credential. The site is now the Moti Bagh colony. If you’re mapping for Kabir, tag this as a “memory coordinate” and play the sound of footsteps over brick vaults that no longer exist.""}"
